[
  {
    "request_id": "EDGE-A-01-31D-PASS",
    "is_synthetic": true,
    "request_type": "takedown",
    "platform": "Platform A",
    "category": "CSAM",
    "priority": "urgent",
    "sent_at": "2026-03-10T00:00:00+00:00",
    "acknowledged_at": "2026-03-10T00:15:00+00:00",
    "claimed_removal_at": "2026-03-10T01:30:00+00:00",
    "data_provided_at": null,
    "police_unit_id": "KL-CCPS-TVM",
    "is_complete_request": true,
    "incompletion_reason": null,
    "status": "claimed_removed",
    "rejection_reason": null,
    "content_url_hmac": "e3a3cfe78ee56e63e28982d9033ac6b957bcedabb7453b1ae8a37510c7e14ad5",
    "content_url_hash": "e3a3cfe78ee56e63e28982d9033ac6b957bcedabb7453b1ae8a37510c7e14ad5",
    "legal_route": "court_order_or_govt_intimation",
    "jurisdiction": "Kerala",
    "district": "Thiruvananthapuram"
  },
  {
    "request_id": "EDGE-A-02-32B-PASS",
    "is_synthetic": true,
    "request_type": "takedown",
    "platform": "Platform A",
    "category": "NonConsensualImagery",
    "priority": "urgent",
    "sent_at": "2026-03-10T02:00:00+00:00",
    "acknowledged_at": "2026-03-10T02:15:00+00:00",
    "claimed_removal_at": "2026-03-10T03:12:00+00:00",
    "data_provided_at": null,
    "police_unit_id": "KL-CCPS-EKM",
    "is_complete_request": true,
    "incompletion_reason": null,
    "status": "claimed_removed",
    "rejection_reason": null,
    "content_url_hmac": "778ab0474cefb1b8aab4678549e88b19d47ce87240405e115181320ea2854b68",
    "content_url_hash": "778ab0474cefb1b8aab4678549e88b19d47ce87240405e115181320ea2854b68",
    "legal_route": "grievance_complaint_3_2_b",
    "jurisdiction": "Kerala",
    "district": "Ernakulam"
  },
  {
    "request_id": "EDGE-A-03-32B-MISS",
    "is_synthetic": true,
    "request_type": "takedown",
    "platform": "Platform A",
    "category": "NonConsensualImagery",
    "priority": "urgent",
    "sent_at": "2026-03-10T04:00:00+00:00",
    "acknowledged_at": "2026-03-10T04:15:00+00:00",
    "claimed_removal_at": "2026-03-10T07:30:00+00:00",
    "data_provided_at": null,
    "police_unit_id": "KL-CCPS-EKM",
    "is_complete_request": true,
    "incompletion_reason": null,
    "status": "claimed_removed",
    "rejection_reason": null,
    "content_url_hmac": "2ad1bfd8dc944bfaf79c5b89546da654ebfbfa5f32b6581d1fe6d5bade6c6f87",
    "content_url_hash": "2ad1bfd8dc944bfaf79c5b89546da654ebfbfa5f32b6581d1fe6d5bade6c6f87",
    "legal_route": "grievance_complaint_3_2_b",
    "jurisdiction": "Kerala",
    "district": "Ernakulam"
  },
  {
    "request_id": "EDGE-A-04-STRICTEST-WINS",
    "is_synthetic": true,
    "request_type": "takedown",
    "platform": "Platform A",
    "category": "ViolenceIncitement",
    "priority": "emergency_life_threat",
    "sent_at": "2026-03-10T08:00:00+00:00",
    "acknowledged_at": "2026-03-10T08:15:00+00:00",
    "claimed_removal_at": "2026-03-10T10:30:00+00:00",
    "data_provided_at": null,
    "police_unit_id": "KL-CYBERDOME",
    "is_complete_request": true,
    "incompletion_reason": null,
    "status": "claimed_removed",
    "rejection_reason": null,
    "content_url_hmac": "b0cf2386363c1a7b476d5599b6ddcf9731cb52d096b1226ae7298e4c6880eabe",
    "content_url_hash": "b0cf2386363c1a7b476d5599b6ddcf9731cb52d096b1226ae7298e4c6880eabe",
    "legal_route": "court_order_or_govt_intimation",
    "jurisdiction": "Kerala",
    "district": "Statewide"
  },
  {
    "request_id": "EDGE-A-05-VERIFIER-WINS",
    "is_synthetic": true,
    "request_type": "takedown",
    "platform": "Platform A",
    "category": "CSAM",
    "priority": "urgent",
    "sent_at": "2026-03-10T12:00:00+00:00",
    "acknowledged_at": "2026-03-10T12:15:00+00:00",
    "claimed_removal_at": "2026-03-10T18:00:00+00:00",
    "data_provided_at": null,
    "police_unit_id": "KL-CCPS-KZD",
    "is_complete_request": true,
    "incompletion_reason": null,
    "status": "claimed_removed",
    "rejection_reason": null,
    "content_url_hmac": "ddfe4b43f32e9c02f55aaf0f9510395e7e7028125643db48ddffa1f1e0e6b4fe",
    "content_url_hash": "ddfe4b43f32e9c02f55aaf0f9510395e7e7028125643db48ddffa1f1e0e6b4fe",
    "legal_route": "court_order_or_govt_intimation",
    "jurisdiction": "Kerala",
    "district": "Kozhikode"
  },
  {
    "request_id": "EDGE-A-06-FALSE-CLAIM",
    "is_synthetic": true,
    "request_type": "takedown",
    "platform": "Platform A",
    "category": "FinancialFraud",
    "priority": "urgent",
    "sent_at": "2026-03-10T15:00:00+00:00",
    "acknowledged_at": "2026-03-10T15:15:00+00:00",
    "claimed_removal_at": "2026-03-10T16:00:00+00:00",
    "data_provided_at": null,
    "police_unit_id": "KL-CCPS-TCR",
    "is_complete_request": true,
    "incompletion_reason": null,
    "status": "claimed_removed",
    "rejection_reason": null,
    "content_url_hmac": "5a0af9d9b0e3adee8d5dc1d0dd02c359c3ca0dd960b03564edbd48b716167212",
    "content_url_hash": "5a0af9d9b0e3adee8d5dc1d0dd02c359c3ca0dd960b03564edbd48b716167212",
    "legal_route": "court_order_or_govt_intimation",
    "jurisdiction": "Kerala",
    "district": "Thrissur"
  },
  {
    "request_id": "EDGE-A-07-SILENT-REMOVAL",
    "is_synthetic": true,
    "request_type": "takedown",
    "platform": "Platform A",
    "category": "CSAM",
    "priority": "urgent",
    "sent_at": "2026-03-10T20:00:00+00:00",
    "acknowledged_at": "2026-03-10T20:15:00+00:00",
    "claimed_removal_at": null,
    "data_provided_at": null,
    "police_unit_id": "KL-CCPS-KLM",
    "is_complete_request": true,
    "incompletion_reason": null,
    "status": "acknowledged",
    "rejection_reason": null,
    "content_url_hmac": "e9383f7063ab42147e29f7a33aa56153e7921409f9babcb6399701695358aa60",
    "content_url_hash": "e9383f7063ab42147e29f7a33aa56153e7921409f9babcb6399701695358aa60",
    "legal_route": "court_order_or_govt_intimation",
    "jurisdiction": "Kerala",
    "district": "Kollam"
  },
  {
    "request_id": "EDGE-A-08-UNCERTAIN-FALLBACK",
    "is_synthetic": true,
    "request_type": "takedown",
    "platform": "Platform A",
    "category": "Impersonation",
    "priority": "urgent",
    "sent_at": "2026-03-11T00:00:00+00:00",
    "acknowledged_at": "2026-03-11T00:15:00+00:00",
    "claimed_removal_at": "2026-03-11T02:30:00+00:00",
    "data_provided_at": null,
    "police_unit_id": "KL-CCPS-KNR",
    "is_complete_request": true,
    "incompletion_reason": null,
    "status": "claimed_removed",
    "rejection_reason": null,
    "content_url_hmac": "902af52cda1a963047dfb6618207d6c57a25b4c18a3ea4a4e0b4071cb959c846",
    "content_url_hash": "902af52cda1a963047dfb6618207d6c57a25b4c18a3ea4a4e0b4071cb959c846",
    "legal_route": "court_order_or_govt_intimation",
    "jurisdiction": "Kerala",
    "district": "Kannur"
  },
  {
    "request_id": "EDGE-A-09-REUPLOAD",
    "is_synthetic": true,
    "request_type": "takedown",
    "platform": "Platform A",
    "category": "CSAM",
    "priority": "urgent",
    "sent_at": "2026-03-11T04:00:00+00:00",
    "acknowledged_at": "2026-03-11T04:15:00+00:00",
    "claimed_removal_at": "2026-03-11T06:00:00+00:00",
    "data_provided_at": null,
    "police_unit_id": "KL-CYBERDOME",
    "is_complete_request": true,
    "incompletion_reason": null,
    "status": "claimed_removed",
    "rejection_reason": null,
    "content_url_hmac": "89e2e5f5c719e48a91362d6448d796c940835a20a99a321a70784e7c8acf6ea2",
    "content_url_hash": "89e2e5f5c719e48a91362d6448d796c940835a20a99a321a70784e7c8acf6ea2",
    "legal_route": "court_order_or_govt_intimation",
    "jurisdiction": "Kerala",
    "district": "Statewide"
  },
  {
    "request_id": "EDGE-A-10-IMMATURE-PENDING",
    "is_synthetic": true,
    "request_type": "takedown",
    "platform": "Platform A",
    "category": "CSAM",
    "priority": "urgent",
    "sent_at": "2026-03-14T22:30:00+00:00",
    "acknowledged_at": "2026-03-14T22:45:00+00:00",
    "claimed_removal_at": null,
    "data_provided_at": null,
    "police_unit_id": "KL-CCPS-TVM",
    "is_complete_request": true,
    "incompletion_reason": null,
    "status": "pending",
    "rejection_reason": null,
    "content_url_hmac": "cf71139ae8796a11cf9e0306acbea125c518731fa0b33380b4d2da0e5053deec",
    "content_url_hash": "cf71139ae8796a11cf9e0306acbea125c518731fa0b33380b4d2da0e5053deec",
    "legal_route": "court_order_or_govt_intimation",
    "jurisdiction": "Kerala",
    "district": "Thiruvananthapuram"
  },
  {
    "request_id": "EDGE-A-11-MATURE-OVERDUE",
    "is_synthetic": true,
    "request_type": "takedown",
    "platform": "Platform A",
    "category": "CSAM",
    "priority": "urgent",
    "sent_at": "2026-03-14T00:00:00+00:00",
    "acknowledged_at": "2026-03-14T00:15:00+00:00",
    "claimed_removal_at": null,
    "data_provided_at": null,
    "police_unit_id": "KL-CCPS-TVM",
    "is_complete_request": true,
    "incompletion_reason": null,
    "status": "pending",
    "rejection_reason": null,
    "content_url_hmac": "53327d4911df3b1a7203a16b739e7583b21a94e5e498b4d796d9f0a27c056471",
    "content_url_hash": "53327d4911df3b1a7203a16b739e7583b21a94e5e498b4d796d9f0a27c056471",
    "legal_route": "court_order_or_govt_intimation",
    "jurisdiction": "Kerala",
    "district": "Thiruvananthapuram"
  },
  {
    "request_id": "EDGE-A-12-INCOMPLETE-QUARANTINE",
    "is_synthetic": true,
    "request_type": "takedown",
    "platform": "Platform A",
    "category": "FinancialFraud",
    "priority": "urgent",
    "sent_at": "2026-03-11T12:00:00+00:00",
    "acknowledged_at": "2026-03-11T12:15:00+00:00",
    "claimed_removal_at": null,
    "data_provided_at": null,
    "police_unit_id": "KL-CCPS-EKM",
    "is_complete_request": false,
    "incompletion_reason": "MissingCourtOrder",
    "status": "pending",
    "rejection_reason": null,
    "content_url_hmac": "a451cb1dd79158b1e5928a9e0caad5e5c95f3ab1cee11b7d6850d83114b6d36c",
    "content_url_hash": "a451cb1dd79158b1e5928a9e0caad5e5c95f3ab1cee11b7d6850d83114b6d36c",
    "legal_route": "court_order_or_govt_intimation",
    "jurisdiction": "Kerala",